name,description
/dtdd/iphone-11,"Nói về nâng cấp thì camera chính là điểm có nhiều cải tiến nhất trên thế hệ iPhone mới. Nếu như trước đây iPhone Xr chỉ có một camera thì nay với iPhone 11 chúng ta sẽ có tới hai camera ở mặt sau. Ngoài camera chính vẫn có độ phân giải 12 MP thì chúng ta sẽ có thêm một camera góc siêu rộng và cũng với độ phân giải tương tự. Ảnh chụp chân dung với iPhone 11 Theo Apple thì việc chuyển đổi qua lại giữa hai ống kính thì sẽ không làm thay đổi màu sắc của bức ảnh. Ảnh chụp chế độ chân dung với iPhone 11 Đây là một điều được xem là bước ngoặt bởi những chiếc smartphone Android có nhiều camera hiện nay sẽ thường bị sai lệch về màu sắc khi chuyển đổi qua lại giữa các ống kính gây cảm giác khá khó chịu cho người dùng. Ảnh chụp với Deep Fusion Bên cạnh đó với iPhone 11 thì đây sẽ là lần đầu tiên Apple trang bị khả năng chụp đêm lên chiếc iPhone của mình. Ảnh chụp với chế độ Night Mode Theo trải nghiệm thì tính năng này hoạt động rất hiệu quả đặc biệt trong những môi trường cực kỳ thiếu sáng. Kích hoạt chế độ chụp đêm sẽ do iPhone tự quyết định việc của bạn chỉ cần đưa máy lên và chụp, rất đơn giản. Ảnh chụp chế độ góc siêu rộng Năm nay Apple cũng đã nâng cấp độ phân giải camera trước nên 12 MP thay vì 7 MP như thế hệ trước đó. Camera trước cũng có một tính năng thông minh, khi bạn xoay ngang điện thoại nó sẽ tự kích hoạt chế độ selfie góc rộng để bạn có thể chụp với nhiều người hơn. Ngoài ra, Apple cũng giới thiệu tính năng quay video slow motion dành cho camera trước, điều mà Apple chưa từng trang bị cho những chiếc iPhone trước đây. Xem thêm: Đánh giá chi tiết iPhone 11: Hóa 'bão tố' hay thành 'bom xịt'? Mỗi lần ra iPhone mới là mỗi lần Apple mang đến cho người dùng một trải nghiệm về hiệu năng ""chưa từng có"". Trên iPhone 11 mới Apple nâng cấp con chip của mình lên thế hệ Apple A13 Bionic rất mạnh mẽ. Chiếc iPhone này cũng được nâng cấp dung lượng RAM 4 GB thay vì 3 GB như thế hệ trước đó. Ở mức cấu hình trên giúp điện thoại chơi game tốt với các tựa game phổ biến hiện nay một cách mượt mà, ổn định. Mọi thao tác trên iPhone mới cũng cho tốc độ phản hồi nhanh mà bạn gần như sẽ không cảm nhận được sự giật lag cho dù có sử dụng trong một thời gian dài. Xem thêm: Thử nghiệm độ bền iPhone 11: Cào xước, nung nóng và bẻ cong Phiên bản iOS 15 (12/2021) đi kèm với chiếc iPhone này cũng được trang bị nhiều tính năng hơn giúp bạn sử dụng chiếc iPhone hiệu quả hơn. Face ID trên iPhone 11 cũng được cải tiến để có thể nhận diện ở nhiều góc độ hơn và tốc độ phản hồi nhanh hơn. Chúng ta sẽ có một mặt lưng hoàn thiện dưới dạng kính và Apple nói rằng họ đã sử dụng loại kính bền nhất từ trước tới nay cho chiếc iPhone này. Camera kép trên iPhone mới cũng được thiết kế lại và tin vui là nó sẽ bớt lồi hơn so với trên iPhone Xr trước đây. Điểm nhấn về cụm camera to bản ở mặt sau sẽ giúp người khác dễ dàng nhận biết bạn đang sử dụng một chiếc iPhone 11 trên tay. Logo quả táo truyền thống của Apple nay đã được di chuyển về phần chính giữa của mặt lớn thay vì đặt lệch về phía cạnh trên như những đời iPhone trước đó. Apple cho biết họ đã hoàn thiện trên iPhone mới để nó cho khả năng chống nước tốt hơn và người dùng có thể yên tâm về điều đó.  Khi nói đến thời lượng pin iPhone 11, hẳn nhiều người đã ước ao rằng máy sẽ có viên pin tốt giống như iPhone Xr (có thời lượng pin tốt nhất so với bất kỳ iPhone hiện đại nào). Tuy nhiên bạn sẽ còn có một chiếc máy thậm chí còn tốt hơn nữa. Theo Apple thì chiếc iPhone mới sẽ có thời lượng pin trâu hơn 1 giờ so với chiếc iPhone Xr. Như vậy với iPhone mới bạn hoàn toàn có thể sử dụng máy lên tới 2 ngày mà không cần lo lắng việc thiết bị sẽ hết pin giữa chừng. Tất nhiên máy cũng sẽ hỗ trợ công nghệ sạc nhanh nhưng bạn phải mua thêm củ sạc bên ngoài để có thể sử dụng tính năng này. Với chừng đó tính năng, chừng đó cải tiến thì chiếc iPhone 11 này tự tin sẽ là một đối thủ đáng gờm với những chiếc flagship đến từ các hãng Android đang có mặt trên thị trường."
/dtdd/iphone-12,"Apple đã trang bị con chip mới nhất của hãng (tính đến 11/2020) cho iPhone 12 đó là A14 Bionic, được sản xuất trên tiến trình 5 nm với hiệu suất ổn định hơn so với chip A13 được trang bị trên phiên bản tiền nhiệm iPhone 11. Xem thêm: Tìm hiểu về chip Apple A14 Bionic trên iPhone 12 và iPad Air 2020 Với CPU Apple A14 Bionic, bạn có thể dễ dàng trải nghiệm mọi tựa game với những pha chuyển cảnh mượt mà hay hàng loạt hiệu ứng đồ họa tuyệt đẹp ở mức đồ họa cao mà không lo tình trạng giật lag. Chưa hết, Apple còn gây bất ngờ đến người dùng với hệ thống 5G lần đầu tiên được trang bị trên những chiếc iPhone, cho tốc độ truyền tải dữ liệu nhanh hơn, ổn định hơn. iPhone 12 sẽ chạy trên hệ điều hành iOS 15 (12/2021) với nhiều tính năng hấp dẫn như hỗ trợ Widget cũng như những nâng cấp tối ưu phần mềm đáng kể mang lại những trải nghiệm thú vị mới lạ đến người dùng. iPhone 12 được trang bị hệ thống camera kép bao gồm camera góc rộng và camera siêu rộng có cùng độ phân giải là 12 MP, chế độ ban đêm (Night Mode) trên bộ đôi camera này cũng đã được nâng cấp về phần cứng lẫn thuật toán xử lý, khi chụp những bức ảnh thiếu sáng bạn sẽ nhận được kết quả ấn tượng với màu sắc, độ chi tiết rõ nét đáng kinh ngạc. Bạn có thể khám phá thêm những tính năng của camera trên iPhone 12 như chế độ smart HDR 3 giúp cân bằng yếu tố ánh sáng trong ảnh, làm nổi bật chi tiết đối tượng và cây cối trong khi vẫn giữ được màu sắc phong phú của bầu trời ngay cả vào buổi trưa nắng gắt. Chế độ chụp chân dung đã tốt nay còn tốt hơn trong việc làm mờ hậu cảnh một cách nghệ thuật để dồn hết sự tập trung vào đối tượng mà bạn muốn chụp. Bạn sẽ dễ dàng quay video 4K HDR với chuẩn điện ảnh Dolby Vision và chỉnh sửa ngay trên chiếc điện thoại của mình, bạn có thể đưa video lên TV của bạn để thưởng thức thước phim sắc nét chất lượng cao. Sự kết hợp của 2 cảm biến chất lượng này đã tạo nên một hệ thống camera chuyên nghiệp không khác gì những chiếc máy ảnh thực thụ, dễ dàng đem lại những bức hình sắc nét tuyệt đối, độ chi tiết cao và đa dạng chế độ chụp cho người dùng linh hoạt sử dụng. Về ngoại hình iPhone 12 có thiết kế hoài niệm với phần cạnh được làm vuông vức tương tự trên mẫu iPhone 4 thay vì bo cong như iPhone 11. Ở mặt trước iPhone 12 phần tai thỏ được làm nhỏ gọn hơn và cũng là nơi chứa cảm biến Face ID có thể nhận diện khuôn mặt một cách nhanh chóng và chính xác. Apple còn mang đến cho người một loạt gam màu cá tính, độc đáo trên những chiếc iPhone của mình để người dùng có sự lựa chọn phù hợp với những phong cách khác nhau. iPhone 12 được trang bị màn hình OLED tràn viền có kích thước 6.1 inch, cho bạn không gian trải nghiệm lớn cũng như những giây phút giải trí hấp dẫn trên một màn ảnh vô cùng chất lượng. Máy được chế tác có độ hoàn thiện cực cao với thiết kế nguyên khối, khung nhôm và mặt sau là kính cường lực cao cấp toát lên vẻ ngoài sang chảnh cũng như mang lại độ hiệu quả an toàn cao mỗi khi sử dụng. Mặt trước của iPhone 12 được phủ hoàn toàn bởi lớp kính cường lực Ceramic Shield cứng cáp, được đánh giá là có độ bền cao và cứng cáp hơn hầu hết các loại mặt kính có trên điện thoại thông minh khác có mặt trên thị trường. Xem thêm: Mặt kính Ceramic Shield trên iPhone 12 là gì? Có xịn sò như quảng cáo? Và để cho thiết bị trở nên hoàn hảo hơn nên không thể thiếu khả năng kháng nước, bụi chuẩn IP68 giúp người dùng yên tâm sử dụng với những buổi đi chơi biển mà không hề lo chiếc máy bị vô nước. Để bạn có những giây phút trải nghiệm liền mạch, Apple đã trang bị một viên pin có dung lượng 2815 mAh, tích hợp cho khả năng tiết kiệm pin giúp người dùng có thể giải trí đa phương tiện lên đến 17 giờ và nghe nhạc liên tục lên đến 65 giờ. Và không thể thiếu đó chính là tính năng sạc nhanh, iPhone 12 có khả năng sạc pin nhanh qua cáp công suất 20 W, chỉ trong vòng 30 phút thì chiếc máy đã có thế sạc được 50% pin. Thêm vào đó là khả năng sạc không dây MagSafe vô cùng tiện dụng. Lưu ý: Củ sạc không kèm theo máy mà phải mua riêng. Xem thêm: MagSafe trên iPhone 12 là gì? Dùng để làm gì trên các thiết bị Apple? Sự lột xác đầy mạnh mẽ lần này của Apple không chỉ gây bất ngờ đến người dùng mà còn đánh dấu một kỷ nguyên mới trong nền phát triển smartphone Apple. Và đây cũng được xem là một trong những bộ series iPhone mà Apple đặt nhiều tâm huyết, mục đích và đầy tính năng mạnh mẽ chưa từng thấy."
/dtdd/iphone-13,"Con chip Apple A15 Bionic siêu mạnh được sản xuất trên quy trình 5 nm giúp iPhone 13 đạt hiệu năng ấn tượng, với CPU nhanh hơn 50%, GPU nhanh hơn 30% so với các đối thủ trong cùng phân khúc. Nhờ hiệu năng được cải tiến, người dùng có được những trải nghiệm tốt hơn trên điện thoại khi dùng các ứng dụng chỉnh sửa ảnh hay chiến các tựa game đồ họa cao mượt mà. iPhone 13 trang bị bộ nhớ trong 128 GB dung lượng lý tưởng cho phép bạn thỏa thích lưu trữ mọi nội dung theo ý muốn mà không lo nhanh đầy bộ nhớ. Mạng 5G được cải thiện chất lượng với nhiều băng tần hơn, với 5G giúp điện thoại xem trực tuyến hay tải xuống các ứng dụng và tài liệu đều đạt tốc độ nhanh chóng. Không chỉ vậy, siêu phẩm mới này còn có chế độ dữ liệu thông minh, tự động phát hiện và giảm tải tốc độ mạng để tiết kiệm năng lượng khi không cần dùng tốc độ cao. iPhone 13 sử dụng tấm nền OLED với kích thước màn hình 6.1 inch cho chất lượng màu sắc và chi tiết hình ảnh sắc nét, sống động, độ phân giải đạt 1170 x 2532 Pixels. Nhờ có công nghệ Super Retina XDR giúp cho máy đạt độ sáng 800 nits, tối đa lên đến 1200 nits cùng dải màu rộng P3, tỷ lệ tương phản lớn giúp ổn định tốt màu sắc và chất lượng hình ảnh hiển thị trong nhiều điều kiện sáng khác nhau, kể cả môi trường nắng gắt hay ánh sáng chói. Phía ngoài màn hình còn được phủ lớp oleophobic hạn chế tình trạng bám bụi bẩn và mồ hôi do tay người dùng, giữ màn hình luôn sạch và tinh tế hơn. Và trang bị kính cường lực Ceramic Shield giúp màn hình của máy được an toàn hơn trước những vết xước, va đập trong quá trình sử dụng. Cụm camera kép phía sau trên iPhone 13 đều sở hữu độ phân giải 12 MP, camera chính giúp thu được nhiều ánh sáng hơn, tăng khả năng thu sáng lên đến 47% nên chất lượng ảnh chụp cũng cải thiện hơn so với bản tiền nhiệm. Điện thoại có camera góc siêu rộng cho góc nhìn 120 độ giúp thu được nhiều chi tiết hơn, dễ dàng ghi lại những khung cảnh núi non hùng vĩ, ảnh chụp nhóm đông người. Cụm camera cũng được trang bị tính năng chống rung quang học Sensor Shift giúp lấy nét nhanh chóng, khả năng chụp đêm cũng trở nên rõ nét mà ít bị nhiễu hạt, hay quay video cũng rất ổn định và mượt mà hơn. “Chế độ điện ảnh” cho phép camera trên iPhone 13 tự động làm mờ hậu cảnh trong video để đối tượng luôn được lấy nét nổi bật. Đặc biệt người dùng có thể thay đổi tiêu điểm để chọn chủ thể mong muốn trong khung hình khi sử dụng quay video, nhờ đó tạo nên những video chuyên nghiệp, như ý hơn. Chế độ chụp Smart HDR 4 nhận diện tối đa 4 người trong một khung hình, tiến hành tối ưu hóa ánh sáng và tương phản, tone màu da cho từng người để hoàn thiện bức ảnh đẹp mà không cần qua chỉnh sửa. Camera trước vẫn nằm trong tai thỏ, độ phân giải cũng đạt 12 MP với các công nghệ chụp ảnh chuyên nghiệp như hiệu ứng bokeh, chế độ điện ảnh, Animoji và Memoji để bạn tự tin thể hiện mình trước ống kính, không lo lắng che giấu khuyết điểm. iPhone 13 có thiết kế nguyên khối vuông vắn như tiền nhiệm, khung viền được làm từ nhôm cùng mặt lưng kính sang trọng, cao cấp. Ngoại hình không quá khác biệt so với tiền nhiệm, nhưng tỷ lệ màn hình so với khung máy tốt hơn, phần tai thỏ nhỏ hơn 20% gia tăng diện tích trải nghiệm khi lướt web, xem phim, chơi game. Điểm khác biệt lớn nhất trong ngoại hình có lẽ chính là các cảm biến camera được đặt chéo thay vì xếp thẳng hàng như iPhone 12, tạo điểm nhận diện đặc trưng, mới mẻ và đẹp mắt, sang chảnh hơn. Màu sắc trên mẫu iPhone mới này cũng đa dạng hơn gồm Trắng, Đen, Đỏ, Xanh dương và Hồng mới mẻ dễ tùy chọn cho mọi người dùng. iPhone 13 hỗ trợ chuẩn kháng nước và bụi IP68, bạn sẽ yên tâm sử dụng hơn khi đem theo thiết bị để chụp ảnh khi bơi hay những lần vô tình làm đổ nước, có cơn mưa đột ngột. Theo công bố của hãng, iPhone 13 có thời lượng pin tăng thêm 2.5 tiếng so với thế hệ trước, cho thời gian sử dụng lâu hơn, phục vụ hiệu quả với người dùng có nhu cầu sử dụng tần suất cao. Hỗ trợ sạc nhanh 20 W giúp nạp đầy 50% pin chỉ trong khoảng 30 phút. Đi kèm theo các công nghệ sạc không dây tiên tiến như chuẩn Qi hay MagSafe. Lưu ý: Củ sạc nhanh 20 W sẽ không đi kèm trong hộp khi mua. Tóm lại, với những nâng cấp và cải tiến mạnh mẽ về hiệu năng, camera đa chức năng, mình nghĩ rằng iPhone 13 128GB sẽ là một chiếc điện thoại cao cấp rất đáng được đầu tư và sử dụng. Tham khảo ngay loạt sản phẩm iPhone mới nhất năm 2022 nhiều mẫu mã: iPhone 14, iPhone 14 Pro, iPhone 14 Plus, iPhone 14 Pro Max khuyến mãi giảm giá đến hàng triệu kèm nhiều quà tặng kèm theo hấp dẫn đang chờ bạn."
